"5";"Cloudkill";"5th level Conjuration";"1 action";"120 feet";"V, S";"Concentration, up to 10 minutes";"You create a 20-foot-radius sphere of poisonous, yellow-green fog centered on a point you choose within range. The fog spreads around corners. It lasts for the duration or until strong wind disperses the fog, ending the spell. Its area is heavily obscured.<br> When a creature enters the spell's area for the first time on a turn or starts its turn there, that creature must make a Constitution saving throw. The creature takes 5d8 poison damage on a failed save, or half as much damage on a successful one. Creatures are affected even if they hold their breath or don't need to breathe.<br> The fog moves 10 feet away from you at the start of each of your turns, rolling along the surface of the ground. The vapors, being heavier than air, sink to the lowest level of the land, even pouring down openings.<br> <b>At Higher Levels</b>: When you cast this spell using a spell slot of 6th level or higher, the damage increases by 1d8 for each slot level above 5th.";"Cleric (Death)"
"5";"Destructive Wave";"5th level Evocation";"1 action";"Self (30-foot radius)";"V";"Instantaneous";"You strike the ground, creating a burst of divine energy that ripples outward from you. Each creature you choose within 30 feet of you must succeed on a Constitution saving throw or take 5d6 thunder damage, as well as 5d6 radiant or necrotic damage (your choice), and be knocked prone. A creature that succeeds on its saving throw takes half as much damage and isn't knocked prone.";"Cleric (Tempest)"
"5";"Dominate Person";"5th level Enchantment ";"1 action";"60 feet";"V, S";"Concentration, up to 1 minute";"You attempt to beguile a humanoid that you can see within range. It must succeed on a Wisdom saving throw or be charmed by you for the duration. If you or creatures that are friendly to you are fighting it, it has advantage on the saving throw.<br> While the target is charmed, you have a telepathic link with it as long as the two of you are on the same plane of existence. You can use this telepathic link to issue commands to the creature while you are conscious (no action required), which it does its best to obey. You can specify a simple and general course of action, such as Attack that creature, Run over there, or Fetch that object. If the creature completes the order and doesn't receive further direction from you, it defends and preserves itself to the best of its ability.<br> You can use your action to take total and precise control of the target. Until the end of your next turn, the creature takes only the actions you choose, and doesn't do anything that you don't allow it to do. During this time you can also cause the creature to use a reaction, but this requires you to use your own reaction as well.<br> Each time the target takes damage, it makes a new Wisdom saving throw against the spell. If the saving throw succeeds, the spell ends.<br> <b>At Higher Levels</b>: When you cast this spell using a 6th-level spell slot, the duration is concentration, up to 10 minutes. When you use a 7th-level spell slot, the duration is concentration, up to 1 hour. When you use a spell slot of 8th level or higher, the duration is concentration, up to 8 hours. ";"Cleric (Trickery)"
"5";"Hold Monster";"5th level Enchantment ";"1 action";"90 feet";"V, S, M";"Concentration, up to 1 minute";"(a small, straight piece of iron)Choose a creature that you can see within range. The target must succeed on a Wisdom saving throw or be paralyzed for the duration. This spell has no effect on undead. At the end of each of its turns, the target can make another Wisdom saving throw. On a success, the spell ends on the target.<br> <b>At Higher Levels</b>: When you cast this spell using a spell slot of 6th level or higher, you can target on additional creature for each slot level above 5th. The creatures must be within 30 feet of each other when you target them. ";"Cleric (War)"
"5";"Modify Memory";"5th level Enchantment ";"1 action";"30 feet";"V, S";"Concentration, up to 1 minute";"You attempt to reshape another creature's memories. One creature that you can see must make a Wisdom saving throw. If you are fighting the creature, it has advantage on the saving throw. On a failed save, the target becomes charmed by you for the duration. The charmed target is incapacitated and unaware of its surroundings, though it can still hear you. If it takes any damage or is targeted by another spell, this spell ends, and none of the target's memories are modified.<br> While this charm lasts, you can affect the target's memory of an event that it experienced within the last 24 hours and that lasted no more than 10 minutes. You can permanently eliminate all memory of the event, allow the target to recall the event with perfect clarity and exacting detail, change its memory of the details of the event, or create a memory of some other event.<br> You must speak to the target to describe how its memories are affected, and it must be able to understand your language for the modified memories to take root. Its mind fills in any gaps in the details of your description. If the spell ends before you have finished describing the modified memories, the creature's memory isn't altered. Otherwise, the modified memories take hold when the spell ends.<br> A modified memory doesn't necessarily affect how a creature behaves, particularly if the memory contradicts the creature's natural inclinations, alignment, or beliefs. An illogical modified memory, such as implanting a memory of how much the creature enjoyed dousing itself in acid, is dismissed, perhaps as a bad dream. The DM might deem a modified memory too nonsensical to affect a creature in a significant manner.<br> A <i>remove curse</i> or <i>greater restoration</i> spell cast on the target restores the creature's true memory.<br> <b>At Higher Levels</b>: If you cast this spell using a spell slot of 6th level or higher, you can alter the target's memories of an event that took place up to 7 days ago (6th level), 30 days ago (7th level), 1 year ago (8th level), or any time in the creature's past (9th level). ";"Cleric (Trickery)"
"5";"Teleportation Circle";"5th level Conjuration";"1 minute";"10 feet";"V, M";"1 round";"(rare chalks and inks infused with precious gems with 50 gp, which the spell consumes)As you cast the spell, you draw a 10-foot-diameter circle on the ground inscribed with sigils that link your location to a permanent teleportation circle of your choice whose sigil sequence you know and that is on the same plane of existence as you. A shimmering portal opens within the circle you drew and remains open until the end of your next turn. Any creature that enters the portal instantly appears within 5 feet of the destination circle or in the nearest unoccupied space if that space is occupied.<br> Many major temples, guilds, and other important places have permanent teleportation circles inscribed somewhere within their confines. Each such circle includes a unique sigil sequence - a string of magical runes arranged in a particular pattern. When you first gain the ability to cast this spell, you learn the sigil sequences for two destinations on the Material Plane, determined by the DM. You can learn additional sigil sequences during your adventures. You can commit a new sigil sequence to memory after studying it for 1 minute.<br> You can create a permanent teleportation circle by casting this spell in the same location every day for one year. You need not use the circle to teleport when you cast the spell in this way. ";"Cleric (Arcana)"
"5";"Tree Stride";"5th level Conjuration";"1 action";"Self";"V, S";"Concentration, up to 1 minute";"You gain the ability to enter a tree and move from inside it to inside another tree of the same kind within 500 feet. Both trees must be living and at least the same size as you. You must use 5 feet of movement to enter a tree. You instantly know the location of all other trees of the same kind within 500 feet and, as part of the move used to enter the tree, can either pass into one of those trees or step out of the tree you're in. You appear in a spot of your choice within 5 feet of the destination tree, using another 5 feet of movement. If you have no movement left, you appear within 5 feet of the tree you entered.<br> You can use this transportation ability once per round for the duration. You must end each turn outside a tree. ";"Cleric (Nature)"
"5";"Commune (ritual)";"5th level Divination";"1 minute";"Self";"V, S, M";"1 minute";"(incense and a vial of holy or unholy water)You contact your deity or a divine proxy and ask up to three questions that can be answered with a yes or no. You must ask your questions before the spell ends. You receive a correct answer for each question.<br> Divine beings aren't necessarily omniscient, so you might receive unclear as an answer if a question pertains to information that lies beyond the deity's knowledge. In a case where a one-word answer could be misleading or contrary to the deity's interests, the DM might offer a short phrase as an answer instead.<br> If you cast the spell two or more times before finishing your next long rest, there is a cumulative 25 percent chance for each casting after the first that you get no answer. The DM makes this roll in secret. ";"Cleric (Order)"
"5";"Dominate Person";"5th level Enchantment ";"1 action";"60 feet";"V, S";"Concentration, up to 1 minute";"You attempt to beguile a humanoid that you can see within range. It must succeed on a Wisdom saving throw or be charmed by you for the duration. If you or creatures that are friendly to you are fighting it, it has advantage on the saving throw.<br> While the target is charmed, you have a telepathic link with it as long as the 2 of you are on the same plane of existence. You can use this telepathic link to issue commands to the creature while you are conscious (no action required), which it does its best to obey. You can specify a simple and general course of action, such as Attack that creature, Run over there, or Fetch that object. If the creature completes the order and doesn't receive further direction from you, it defends and preserves itself to the best of its ability.<br> You can use your action to take total and precise control of the target. Until the end of your next turn, the creature takes only the actions you choose, and doesn't do anything that you don't allow it to do. During this time you can also cause the creature to use a reaction, but this requires you to use your own reaction as well.<br> Each time the target takes damage, it makes a new Wisdom saving throw against the spell. If the saving throw succeeds, the spell ends.<br><br><b>At Higher Levels</b>: When you cast this spell using a 6th-level spell slot, the duration is concentration, up to 10 minutes. When you use a 7th-level spell slot, the duration is concentration, up to 1 hour. When you use a spell slot of 8th level or higher, the duration is concentration, up to 8 hours. ";"Cleric (Order)"
"5";"Greater Restoration";"5th level Abjuration";"1 action";"Touch";"V, S, M";"Instantaneous";"(diamond dust worth 100 gp, which the spell consumes)You imbue a creature you touch with positive energy to undo a debilitating effect. You can reduce the target's exhaustion level by one, or end one of the following effects on the target.<br>  One effect that charmed or petrified the target<br>  One curse, including the target's attunement to a cursed magic item<br>  Any reduction to one of the target's ability scores<br>  One effect reducing the target's hit point maximum ";"Cleric (Peace)"
"5";"Rary's Telepathic Bond (ritual)";"5th level Divination";"1 action";"30 feet";"V, S, M";"1 hour";"(pieces of eggshell from two different kinds of creatures)You forge a telepathic link among up to eight willing creatures of your choice within range, psychically linking each creature to all the others for the duration. Creatures with Intelligence scores of 2 or less aren't affected by this spell.<br> Until the spell ends, the targets can communicate telepathically through the bond whether or not they have a common language. The communication is possible over any distance, though it can't extend to other planes of existence. ";"Cleric (Peace)"
"5";"Circle of Power";"5th level Abjuration";"1 action";"Self (30-foot radius)";"V";"Concentration, up to 10 minutes";"Divine energy radiates from you, distorting and diffusing magical energy within 30 feet of you. Until the spell ends, the sphere moves with you, centered on you. For the duration, each friendly creature in the area (including you) has advantage on saving throws against spells and other magical effects. Additionally, when an affected creature succeeds on a saving throw made against a spell or magical effect that allows it to make a saving throw to take only half damage, it instead takes no damage if it succeeds on the saving throw.";"Cleric (Twilight)"
"5";"Mislead";"5th level Illusion";"1 action";"Self";"S";"Concentration, up to 1 hour";"You become invisible at the same time that an illusory double of you appears where you are standing. The double lasts for the duration, but the invisibility ends if you attack or cast a spell.<br> You can use your action to move your illusory double up to twice your speed and make it gesture, speak, and behave in whatever way you choose.<br> You can see through its eyes and hear through its ears as if you were located where it is. On each of your turns as a bonus action, you can switch from using its senses to using your own, or back again. While you are using its senses, you are blinded and deafened in regard to your own surroundings. ";"Cleric (Twilight)"
"3";"Spirit Shroud";"3rd-level necromancy";"1 bonus action";"Self";"V, S";"Concentration, up to 1 minute";"You call forth spirits of the dead, which lit around you for the spell's duration. The spirits are intangible and invulnerable.<br>Until the spell ends, any attack you make deals 1d8 extra damage when you hit a creature within 10 feet of you. This damage is radiant, necrotic, or cold (your choice when you cast the spell). Any creature that takes this damage can't regain hit points until the start of your next turn.<br>In addition, any creature of your choice that you can see that starts its turn within 10 feet of you has its speed reduced by 10 feet until the start of your next turn.<br><b>At Higher Levels</b>: When you cast this spell using a spell slot of 4th level or higher, the damage increases by 1d8 for every two slot levels above 3rd.";"Cleric (TCE)"
"3";"Aura of Vitality";"3rd level Evocation";"1 action";"Self (30-foot radius)";"V";"Concentration, up to 1 minute";"Healing energy radiates from you in an aura with a 30-foot radius. Until the spell ends, the aura moves with you, centered on you. You can use a bonus action to cause one creature in the aura (including you) to regain 2d6 hit points.";"Cleric (TCE)"
"4";"Aura of Life";"4th level Abjuration";"1 action";"Self (30-foot radius)";"V";"Concentration, up to 10 minutes";"Life-preserving energy radiates from you in an aura with a 30-foot radius. Until the spell ends, the aura moves with you, centered on you. Each non-hostile creature in the aura (including you) has resistance to necrotic damage, and its hit point maximum can't be reduced. In addition, a non-hostile, living creature regains 1 hit point when it starts its turn in the aura with 0 hit points.";"Cleric (TCE)"
"4";"Aura of Purity";"4th level Abjuration";"1 action";"Self (30-foot radius)";"V";"Concentration, up to 10 minutes";"Purifying energy radiates from you in an aura with a 30-foot radius. Until the spell ends, the aura moves with you, centered on you. Each non-hostile creature in the aura (including you) can't become diseased, has resistance to poison damage, and has advantage on saving throws against effects that cause any of the following conditions: blinded, charmed, deafened, frightened, paralyzed, poisoned, and stunned.";"Cleric (TCE)"
"5";"Summon Celestial";"5th-level conjuration";"1 action";"90 feet";"V, S, M";"Concentration, up to 1 hour";"(a golden reliquary worth at least 500 gp)You call forth a celestial spirit. It manifests in an angelic form in an unoccupied space that you can see within range. This corporeal form uses the Celestial Spirit stat block. When you cast the spell, choose Avenger or Defender. Your choice determines the creature's attack in its stat block. The creature disappears when it drops to 0 hit points or when the spell ends.<br>The creature is an ally to you and your companions. In combat, the creature shares your initiative count, but it takes its turn immediately after yours. It obeys your verbal commands (no action required by you). If you don't issue any, it takes the Dodge action and uses its move to avoid danger.<br><b>At Higher Levels</b>: When you cast this spell using a spell slot of 6th level or higher, use the higher level whenever the spell's level appears in the stat block.";"Cleric (TCE)"
"6";"Sunbeam";"6th level Evocation";"1 action";"Self (60-foot line)";"V, S, M";"Concentration, up to 1 minute";"(a magnifying glass)A beam of brilliant light flashes out from your hand in a 5-foot-wide, 60-foot-line. Each creature in the line must make a Constitution saving throw. On a failed save, a creature takes 6d8 radiant damage and is blinded until your next turn. On a successful save, it takes half as much damage and isn't blinded by this spell. Undead and oozes have disadvantage on this saving throw.<br> You can create a new line of radiance as your action on any turn until the spell ends.<br> For the duration, a mote of brilliant radiance shines in your hand. It sheds bright light in a 30-foot radius and dim light for an additional 30 feet. The light is sunlight. ";"Cleric (TCE)"
"8";"Sunburst";"8th level Evocation";"1 action";"150 feet";"V, S, M";"Instantaneous";"(fire and a piece of sunstone)Brilliant sunlight flashes in a 60-foot radius centered on a point you choose within range. Each creature in that light must make a Constitution saving throw. On a failed save, a creature takes 12d6 radiant damage and is blinded for 1 minute. On a successful save, it takes half as much damage and isn't blinded by this spell. Undead and oozes have disadvantage on this saving throw.<br> A creature blinded by this spell makes another Constitution saving throw at the end of each of its turns. On a successful save, it is no longer blinded.<br> This spell dispels any darkness in its area that was created by a spell. ";"Cleric (TCE)"
"9";"Power Word Heal";"9th level Evocation";"1 action";"Touch";"V, S";"Instantaneous";"A wave of healing energy washes over the creature you touch. The target regains all its hit points. If the creature is charmed, frightened, paralyzed, or stunned, the condition ends. If the creature is prone, it can use its reaction to stand up. This spell has no effect on undead or constructs.";"Cleric (TCE)"
