"1";"Animal Friendship";"1st level Enchantment ";"1 action";"30 feet";"V, S, M";"24 hours";"(a morsel of food)This spell lets you convince a beast that you mean it no harm. Choose a beast that you can see within range. It must see and hear you. If the beast's Intelligence is 4 or higher, the spell fails. Otherwise, the beast must succeed on a Wisdom saving throw or be charmed by you for the spell's duration. If you or one of your companions harms the target, the spell ends.<br> <b>At Higher Levels</b>: When you cast this spell using a 2nd level spell slot or higher, you can affect one additional beast for each slot level above 1st. ";"Cleric (Nature)"
"1";"Charm Person";"1st level Enchantment ";"1 action";"30 feet";"V, S";"1 hour";"You attempt to charm a humanoid you can see within range. It must make a Wisdom saving throw, and does so with advantage if you or your companions are fighting it. If it fails the saving throw, it is charmed by you until the spell ends or until you or your companions do anything harmful to it. The charmed creature regards you as a friendly acquaintance. When the spell ends, the creature knows it was charmed by you.<br> <b>At Higher Levels</b>: When you cast this spell using a spell slot of 2nd level or higher, you can target one additional creature for each slot level above 1st. The creatures must be within 30 feet of each other when you target them. ";"Cleric (Trickery)"
"1";"Disguise Self";"1st level Illusion";"1 action";"Self";"V, S";"1 hour";"You make yourself, including your clothing, armor, weapons, and other belongings on your person, look different until the spell ends or until you use your action to dismiss it. You can seem 1 foot shorter or taller and can appear thin, fat, or in between. You can't change your body type, so you must adopt a form that has the same basic arrangement of limbs. Otherwise, the extent of the illusion is up to you.<br> The changes wrought by this spell fail to hold up to physical inspection. For example, if you use this spell to add a hat to your outfit, objects pass through the hat, and anyone who touches it would feel nothing or would feel your head and hair. If you use this spell to appear thinner than you are, the hand of someone who reaches out to touch you would bump into you while it was seemingly still in midair.<br> To discern that you are disguised, a creature can use its action to inspect your appearance and must succeed on an Intelligence (Investigation) check against your spell save DC. ";"Cleric (Trickery)"
"1";"Divine Favor";"1st level Evocation";"1 bonus action";"Self";"V, S";"Concentration, up to 1 minute";"Your prayer empowers you with divine radiance. Until the spell ends, your weapon attacks deal and extra 1d4 radiant damage on a hit.";"Cleric (War)"
"1";"False Life";"1st level Necromancy";"1 action";"Self";"V, S, M";"1 hour";"(a small amount of alcohol or distilled spirits)Bolstering yourself with a necromantic facsimile of life, you gain 1d4+4 temporary hit points for the duration.<br> <b>At Higher Levels</b>: When you cast this spell using a spell slot of 2nd level or higher, you gain 5 additional temporary hit points for each slot level above 1st. ";"Cleric (Death)(Grave)"
"1";"Fog Cloud";"1st level Conjuration";"1 action";"120 feet";"V, S";"Concentration, up to 1 hour";"You create a 20-foot-radius sphere of fog centered on a point within range. The sphere spreads around corners, and its area is heavily obscured. It lasts for the duration or until a wind of moderate or greater speed (at least 10 miles per hour) disperses it.<br> <b>At Higher Levels</b>: When you cast this spell using a spell slot of 2nd level or higher, the radius of the fog increases by 20 feet for each slot level above 1st. ";"Cleric (Tempest)"
"1";"Identify (ritual)";"1st level Divination";"1 minute";"Touch";"V, S, M";"Instantaneous";"(a pearl worth at least 100 gp and an owl feather)You choose one object that you must touch throughout the casting of the spell. If it is a magic item or some other magic-imbued object, you learn its properties and how to use them, whether it requires attunement to use, and how many charges it has, if any. You learn whether any spells are affecting the item and what they are. If the item was created by a spell, you learn which spell created it.<br> If you instead touch a creature throughout the casting, you learn what spells, if any, are currently affecting it. ";"Cleric (Knowledge)(Forge)"
"1";"Magic Missile";"1st level Evocation";"1 action";"120 feet";"V, S";"Instantaneous";"You create three glowing darts of magical force. Each dart hits a creature of your choice that you can see within range. A dart deals 1d4+1 force damage to its target. The darts all strike simultaneously and you can direct them to hit one creature or several.<br> <b>At Higher Levels</b>: When you cast this spell using a spell slot of 2nd level or higher, the spell creates one more dart for each slot above 1st. ";"Cleric (Arcana)"
"1";"Ray of Sickness";"1st level Necromancy";"1 action";"60 feet";"V, S";"Instantaneous";"A ray of sickening greenish energy lashes out toward a creature within range. Make a ranged spell attack against the target. On a hit, the target takes 2d8 poison damage and must make a Constitution saving throw. On a failed save, it is also poisoned until the end of your next turn.<br> <b>At Higher Levels</b>: When you cast this spell using a spell slot of 2nd level or higher, the damage increases by 1d8 for each slot level above 1st. ";"Cleric (Death)"
"1";"Speak with Animals (ritual)";"1st level Divination";"1 action";"Self";"V, S";"10 minutes";"You gain the ability to comprehend and verbally communicate with beasts for the duration. The knowledge and awareness of many beasts is limited by their intelligence, but at minimum, beasts can give you information about nearby locations and monsters, including whatever they can perceive or have perceived within the past day. You might be able to persuade a beast to perform a small favor for you, at the DM's discretion.";"Cleric (Nature)"
"1";"Thunderwave";"1st level Evocation";"1 action";"Self (15-foot cube)";"V, S";"Instantaneous";"A wave of thunderous force sweeps out from you. Each creature in a 15-foot cube originating from you must make a Constitution saving throw. On a failed save, a creature takes 2d8 thunder damage and is pushed 10 feet away from you. On a successful save, the creature takes half as much damage and isn't pushed.<br> In addition, unsecured objects that are completely within the area of effect are automatically pushed 10 feet away from you by the spell's effect, and the spell emits a thunderous boom audible out to 300 feet.<br> <b>At Higher Levels</b>: When you cast this spell using a spell slot of 2nd level or higher, the damage increases by 1d8 for each slot level above 1st. ";"Cleric (Tempest)"
"1";"Command";"1st level Enchantment ";"1 action";"60 feet";"V";"1 round";"You speak a one-word command to a creature you can see within range. The target must succeed on a Wisdom saving throw or follow the command on its next turn. The spell has no effect if the target is undead, if it doesn't understand your language, or if your command is directly harmful to it.<br> Some typical commands and their effects follow.<br> You might issue a command other than one described here. If you do so, the DM determines how the target behaves. If the target can't follow your command, the spell ends.<br> <b>Approach</b>: The target moves toward you by the shortest and most direct route, ending its turn if it moves within 5 feet of you.<br> <b>Drop</b>: The target drops whatever it is holding and then ends its turn.<br> <b>Flee</b>: The target spends its turn moving away from you by the fastest available means.<br> <b>Grovel</b>: The target falls prone and then ends its turn.<br> <b>Halt</b>: The target doesn't move and takes no actions. A flying creature stays aloft, provided that it is able to do so. If it must move to stay aloft, it flies the minimum distance needed to remain in the air.<br> <b>At Higher Levels</b>: When you cast this spell using a spell slot of 2nd level or higher, you can affect one additional creature for each slot level above 1st. The creatures must be within 30 feet of each other when you target them. ";"Cleric (Order)"

"1";"Heroism";"1st level Enchantment ";"1 action";"Touch";"V, S";"Concentration, up to 1 minute";"A willing creature you touch is imbued with bravery. Until the spell ends, the creature is immune to being frightened and gains temporary hit points equal to your spellcasting ability modifier at the start of each of its turns. When the spell ends, the target loses any remaining temporary hit points from this spell.<br><br><b>At Higher Levels</b>: When you cast this spell using a spell slot of 2nd level or higher, you can target 1 additional creature for each slot level above 1st. ";"Cleric (Order)"
"1";"Heroism";"1st level Enchantment ";"1 action";"Touch";"V, S";"Concentration, up to 1 minute";"A willing creature you touch is imbued with bravery. Until the spell ends, the creature is immune to being frightened and gains temporary hit points equal to your spellcasting ability modifier at the start of each of its turns. When the spell ends, the target loses any remaining temporary hit points from this spell.<br><br><b>At Higher Levels</b>: When you cast this spell using a spell slot of 2nd level or higher, you can target 1 additional creature for each slot level above 1st. ";"Cleric (Peace)"
"1";"Sanctuary";"1st level Abjuration";"1 bonus action";"30 feet";"V, S, M";"1 minute";"(a small silver mirror)You ward a creature within range against attack. Until the spell ends, any creature who targets the warded creature with an attack or a harmful spell must first make a Wisdom saving throw. On a failed save, the creature must choose a new target or lose the attack or spell. This spell doesn't protect the warded creature from area effects, such as the explosion of a fireball.<br> If the warded creature makes an attack or casts a spell that affects an enemy creature, this spell ends. ";"Cleric (Peace)"
"1";"Faerie Fire";"1st level Evocation";"1 action";"60 feet";"V";"Concentration, up to 1 minute";"Each object in a 20-foot cube within range is outlined in blue, green, or violet light (your choice). Any creature in the area when the spell is cast is also outlined in light if it fails a Dexterity saving throw. For the duration, objects and affected creatures shed dim light in a 10-foot radius.<br> Any attack roll against an affected creature or object has advantage if the attacker can see it, and the affected creature or object can't benefit from being invisible. ";"Cleric (Twilight)"
"1";"Sleep";"1st level Enchantment ";"1 action";"90 feet";"V, S, M";"1 minute";"(A pinch of find sand, rose petals, or a cricket)This spell sends creatures into a magical slumber. Roll 5d8, the total is how many hit points of creatures this spell can affect. Creatures within 20 feet of a point you choose within range are affected in ascending order of their current hit points (ignoring unconscious creatures).<br> Starting with the creature that has the lowest current hit points, each creature affected by this spell falls unconscious until the spell ends, the sleeper takes damage, or someone uses an action to shake or slap the sleeper awake. Subtract each creature's hit points from the total before moving on to the creature with the next lowest hit points. A creature's hit points must be equal to or less than the remaining total for that creature to be affected.<br> Undead and creatures immune to being charmed aren't affected by this spell.<br><br><b>At Higher Levels</b>: When you cast this spell using a spell slot of 2nd level or higher, roll an additional 2d8 for each slot level above 1st. ";"Cleric (Twilight)"
"2";"Barkskin";"2nd level Transmutation";"1 action";"Touch";"V, S, M";"Concentration, up to 1 hour";"(a handful of oak bark)You touch a willing creature. Until the spell ends, the target's skin has a rough, bark-like appearance, and the target's AC can't be less than 16, regardless of what kind of armor it is wearing.";"Cleric (Nature)"
"2";"Gust of Wind";"2nd level Evocation";"1 action";"Self (60-foot line)";"V, S, M";"Concentration, up to 1 minute";"(a legume seed)A line of strong wind 60 feet long and 10 feet wide blasts from you in a direction you choose for the spell's duration. Each creature that starts its turn in the line must succeed on a Strength saving throw or be pushed 15 feet away from you in a direction following the line.<br> Any creature in the line must spend 2 feet of movement for every 1 foot it moves when moving closer to you.<br> The gust disperses gas or vapor, and it extinguishes candles, torches, and similar unprotected flames in the area. It causes protected flames, such as those of lanterns, to dance wildly and has a 50 percent chance to extinguish them.<br> As a bonus action on each of your turns before the spell ends, you can change the direction in which the line blasts from you. ";"Cleric (Tempest)"
"2";"Heat Metal";"2nd level Transmutation";"1 action";"60 feet";"V, S, M";"Concentration, up to 1 minute";"(a piece of iron and a flame)Choose a manufactured metal object, such as a metal weapon or a suit of heavy or medium metal armor, that you can see within range. You cause the object to glow red-hot. Any creature in physical contact with the object takes 2d8 fire damage when you cast the spell. Until the spell ends, you can use a bonus action on each of your subsequent turns to cause this damage again.<br> If a creature is holding or wearing the object and takes the damage from it, the creature must succeed on a Constitution saving throw or drop the object if it can. If it doesn't drop the object, it has disadvantage on attack rolls and ability checks until the start of your next turn.<br> <b>At Higher Levels</b>: When you cast this spell using a spell slot of 3rd level or higher, the damage increases by 1d8 for each slot above 2nd. ";"Cleric (Forge)"
"2";"Magic Weapon";"2nd level Transmutation";"1 bonus action";"Touch";"V, S";"Concentration, up to 1 hour";"You touch a nonmagical weapon. Until the spell ends, that weapon becomes a magic weapon with a +1 bonus to attack rolls and damage rolls.<br> <b>At Higher Levels</b>: When you cast this spell using a spell slot of 4th level or higher, the bonus increases to +2. When you use a spell slot of 6th level or higher, the bonus increases to +3. ";"Cleric (War)(Forge)(Arcana)"
"2";"Mirror Image";"2nd level Illusion";"1 action";"Self";"V, S";"1 minute";"Three illusory duplicates of yourself appear in your space. Until the spell ends, the duplicates move with you and mimic your actions, shifting position so it's impossible to track which image is real. You can use your action to dismiss the illusory duplicates.<br> Each time a creature targets you with an attack during the spell's duration, roll a d20 to determine whether the attack instead targets one of your duplicates.<br> If you have three duplicates, you must roll a 6 or higher to change the attack's target to a duplicate. With two duplicates, you must roll an 8 or higher. With one duplicate, you must roll an 11 or higher.<br> A duplicate's AC equals 10 + your Dexterity modifier. If an attack hits a duplicate, the duplicate is destroyed. A duplicate can be destroyed only by an attack that hits it. It ignores all other damage and effects. The spell ends when all three duplicates are destroyed.<br> A creature is unaffected by this spell if it can't see, if it relies on senses other than sight, such as blindsight, or if it can perceive illusions as false, as with truesight. ";"Cleric (Trickery)"
"2";"Nystul's Magic Aura";"2nd level Illusion";"1 action";"Touch";"V, S, M";"24 hours";"(a small square of silk)You place an illusion on a creature or an object you touch so that divination spells reveal false information about it. The target can be a willing creature or an object that isn't being carried or worn by another creature.<br> When you cast the spell, choose one or both of the following effects. The effect lasts for the duration. If you cast this spell on the same creature or object every day for 30 days, placing the same effect on it each time, the illusion lasts until it is dispelled.<br> <b>False Aura</b>: You change the way the target appears to spells and magical effects, such as <i>detect magic</i>, that detect magical auras. You can make a nonmagical object appear magical, a magical object appear nonmagical, or change the object's magical aura so that it appears to belong to a specific school of magic that you choose. When you use this effect on an object, you can make the false magic apparent to any creature that handles the item.<br> <b>Mask</b>: You change the way the target appears to spells and magical effects that detect creature types, such as a paladin's Divine Sense or the trigger of a <i>symbol</i> spell. You choose a creature type and other spells and magical effects treat the target as if it were a creature of that type or of that alignment. ";"Cleric (Arcana)"
"2";"Pass Without Trace";"2nd level Abjuration";"1 action";"Self";"V, S, M";"Concentration, up to 1 hour";"(ashes from a burned leaf of mistletoe and a sprig of spruce)A veil of shadows and silence radiates from you, masking you and your companions from detection. For the duration, each creature you choose within 30 feet of you (including you) has a +10 bonus to Dexterity (Stealth) checks and can't be tracked except by magical means. A creature that receives this bonus leaves behind no tracks or other traces of its passage.";"Cleric (Trickery)"
"2";"Ray of Enfeeblement";"2nd level Necromancy";"1 action";"60 feet";"V, S";"Concentration, up to 1 minute";"A black beam of enervating energy springs from your finger toward a creature within range. Make a ranged spell attack against the target. On a hit, the target deals only half damage with weapon attacks that use Strength until the spell ends.<br> At the end of each of the target's turns, it can make a Constitution saving throw against the spell. On a success, the spell ends. ";"Cleric (Death)(Grave)"
"2";"Shatter";"2nd level Evocation";"1 action";"60 feet";"V, S, M";"Instantaneous";"(a chip of mica)A sudden loud ringing noise, painfully intense, erupts from a point of your choice within range. Each creature in a 10-foot-radius sphere centered on that point must make a Constitution saving throw. A creature takes 3d8 thunder damage on a failed save, or half as much damage on a successful one. A creature made of inorganic material such as stone, crystal, or metal has disadvantage on this saving throw.<br> A nonmagical object that isn't being worn or carried also takes the damage if it's in the spell's area.<br> <b>At Higher Levels</b>: When you cast this spell using a spell slot of or higher, the damage increases by 1d8 for each slot level above 2nd. ";"Cleric (Tempest)"
"2";"Spike Growth";"2nd level Transmutation";"1 action";"150 feet";"V, S, M";"Concentration, up to 10 minutes";"(seven sharp thorns or seven small twigs, each sharpened to a point)The ground in a 20-foot radius centered on a point within range twists and sprouts hard spikes and thorns. The area becomes difficult terrain for the duration. When a creature moves into or within the area, it takes 2d4 piercing damage for every 5 feet it travels.<br> The transformation of the ground is camouflaged to look natural. Any creature that can't see the area at the time the spell is case must make a Wisdom (Perception) check against your spell save DC to recognize the terrain as hazardous before entering it. ";"Cleric (Nature)"
"2";"Suggestion";"2nd level Enchantment ";"1 action";"30 feet";"V, M";"Concentration, up to 8 hours";"(a snake's tongue and either a bit of honeycomb or a drop of sweet oil)You suggest a course of activity (limited to a sentence or two) and magically influence a creature you can see within range that can hear and understand you. Creatures that can't be charmed are immune to this effect. The suggestion must be worded in such a manner as to make the course of action sound reasonable. Asking the creature to stab itself, throw itself onto a spear, immolate itself, or do some other obviously harmful act ends the spell.<br> The target must make a Wisdom saving throw. On a failed save, it purses the course of action you described to the best of its ability. The suggested course of action can continue for the entire duration. If the suggested activity can be completed in a shorter time, the spell ends when the subject finishes what it was asked to do.<br> You can also specify conditions that will trigger a special activity during the duration. For example, you might suggest that a knight five her warhorse to the first beggar she meets. If the condition isn't met before the spell expires, the activity isn't performed.<br> If you or any of your companions damage the target, the spell ends. ";"Cleric (Knowledge)"
"2";"Hold Person";"2nd level Enchantment ";"1 action";"60 feet";"V, S, M";"Concentration, up to 1 minute";"(a small, straight piece of iron)Choose a humanoid that you can see within range. The target must succeed on a Wisdom saving throw or be paralyzed for the duration. At the end of each of its turns, the target can make another Wisdom saving throw. On a success, the spell ends on the target.<br> <b>At Higher Levels</b>: When you cast this spell using a spell slot of 3rd level or higher, you can target on additional humanoid for each slot level above 2nd. The humanoids must be within 30 feet of each other when you target them. ";"Cleric (Order)"
"2";"Zone of Truth";"2nd level Enchantment ";"1 action";"60 feet";"V, S";"10 minutes";"You create a magical zone that guards against deception in a 15-foot-radius sphere centered on a point of your choice within range. Until the spell ends, a creature that enters the spell's area for the first time on a turn or starts its turn there must make a Charisma saving throw. On a failed save, a creature can't speak a deliberate lie while in the radius. You know whether each creature succeeds or fails on its saving throw.<br> An affected creature is aware of the spell and can thus avoid answering questions to which it would normally respond with a lie. Such creatures can be evasive in its answers as long as it remains within the boundaries of the truth. ";"Cleric (Order)"
"2";"Aid";"2nd level Abjuration";"1 action";"30 feet";"V, S, M";"8 hours";"(a tiny strip of white cloth)Your spell bolsters your allies with toughness and resolve. Choose up to three creatures within range. Each target's hit point maximum and current hit points increase by 5 for the duration.<br> <b>At Higher Levels</b>: When you cast this spell using a spell slot of 3rd level or higher, a target's hit points increase by an additional 5 for each slot level above 2nd. ";"Cleric (Peace)"
"2";"Warding Bond";"2nd level Abjuration";"1 action";"Touch";"V, S, M";"1 hour";"(a pair of platinum rings worth at least 50 gp each, which you and target must wear for the duration)This spell wards a willing creature you touch and creates a mystic connection between you and the target until the spell ends. While the target is within 60 feet of you, it gains a +1 bonus to AC and saving throws, and it has resistance to all damage. Also, each time it takes damage, you take the same amount of damage.<br> The spell ends if you drop to 0 hit points or if you and the target become separated by more than 60 feet. It also ends if the spell is cast again on either of the connected creatures. You can also dismiss the spell as an action. ";"Cleric (Peace)"
"2";"Moonbeam";"2nd level Evocation";"1 action";"120 feet";"V, S, M";"Concentration, up to 1 minute";"(several seeds of any moonseed plant and a piece of opalescent feldspar)A silvery beam of pale light shines down in a 5-foot radius, 40-foot-high cylinder centered on a point within range. Until the spell ends, dim light fills the cylinder.<br> When a creature enters the spell's area for the first time on a turn or starts its turn there, it is engulfed in ghostly flames that cause searing pain, and it must make a Constitution saving throw. It takes 2d10 radiant damage on a failed save, or half as much damage on a successful one.<br> A shapechanger makes its saving throw with disadvantage. If it fails, it also instantly reverts to its original form and can't assume a different form until it leaves the spell's light.<br> On each of your turns after you cast this spell, you can use an action to move the beam 60 feet in any direction.<br> <b>At Higher Levels</b>: When you cast this spell using a spell slot of 3rd level or higher, the damage increases by 1d10 for each slot level above 2nd. ";"Cleric (Twilight)"
"2";"See Invisibility";"2nd level Divination";"1 action";"Self";"V, S, M";"1 hour";"(A pinch of Talc and a small sprinkling of powdered silver)For the duration, you see invisible creatures and objects as if they were visible, and you can see into the Ethereal Plane. Ethereal creatures and objects appear ghostly and translucent.";"Cleric (Twilight)"
