"3";"Blink";"3rd level Transmutation";"1 action";"Self";"V, S";"1 minute";"Roll a d20 at the end of each of your turns for the duration of the spell. On a roll of 11 or higher, you vanish from your current plane of existence and appear in the Ethereal Plane (the spell fails and the casting is wasted if you were already on that plane). At the start of you next turn, and when the spell ends if you are on the Ethereal Plane, you return to an unoccupied space of your choice that you can see within 10 feet of the space you vanished from. If no unoccupied space is available within that range, you appear in the nearest unoccupied space (chosen at random if more than one space is equally near). You can dismiss this spell as an action.<br> While on the Ethereal Plane, you can see and hear the plane you originated from, which is cast in shades of gray, and you can't see anything more than 60 feet away. You can only affect and be affected by other creatures on the Ethereal Plane. Creature that aren't there can't perceive you or interact with you, unless they have the ability to do so. ";"Cleric (Trickery)"
"3";"Call Lightning";"3rd level Conjuration";"1 action";"120 feet";"V, S";"Concentration, up to 10 minutes";"A storm cloud appears in the shape of a cylinder that is 10 feet tall with a 60-foot radius, centered on a point you can see 100 feet directly above you. The spell fails if you can't see a point in the air where the storm cloud could appear (for example, if you are in a room that can't accommodate the cloud).<br> When you cast the spell, choose a point you can see within range. A bolt of lightning flashes down from the cloud to that point. Each creature within 5 feet of that point must make a Dexterity saving throw. A creature takes 3d10 lightning damage on a failed save, or half as much damage on a successful one. On each of your turns until the spell ends, you can use your action to call down lightning in this way again, targeting the same point or a different one.<br> If you are outdoors in stormy conditions when you cast this spell, the spell gives you control over the existing storm instead of creating a new one. Under such conditions, the spell's damage increases by 1d10.<br> <b>At Higher Levels</b>: When you cast this spell using a spell slot of 4th level or higher level, the damage increases by 1d10 for each slot level above 3rd. ";"Cleric (Tempest)"
"3";"Crusader's Mantle";"3rd level Evocation";"1 action";"Self";"V";"Concentration, up to 1 minute";"Holy power radiates from you in an aura with a 30-foot radius, awakening boldness in friendly creatures. Until the spell ends, the aura moves with you, centered on you. While in the aura, each non-hostile creature in the aura (including you) deals an extra 1d4 radiant damage when it hits with a weapon attack.";"Cleric (War)"
"3";"Nondetection";"3rd level Abjuration";"1 action";"Touch";"V, S, M";"8 hours";"(a pinch of diamond dust worth 25 gp sprinkled over the target, which the spell consumes)For the duration, you hide a target that you touch from divination magic. The target can be a willing creature or a place or an object no larger than 10 feet in any dimension. The target can't be targeted by any divination magic or perceived through magical scrying sensors.";"Cleric (Knowledge)"
"3";"Plant Growth";"3rd level Transmutation";"1 action or 8 hours";"150 feet";"V, S";"Instantaneous";"This spell channels vitality into plants within a specific area. There are two possible uses for the spell, granting either immediate or long-term benefits.<br> If you cast this spell using 1 action, choose a point within range. All normal plants in a 100-foot radius centered on that point become thick and overgrown. A creature moving through the area must spend 4 feet of movement for every 1 foot it moves.<br> You can exclude one or more areas of any size within the spell's area from being affected.<br> If you cast this spell over 8 hours, you enrich the land. All plants in a half-mile radius centered on a point within range become enriched for 1 year. The plants yield twice the normal amount of food when harvested. ";"Cleric (Nature)"
"3";"Sleet Storm";"3rd level Conjuration";"1 action";"150 feet";"V, S, M";"Concentration, up to 1 minute";"(a pinch of dust and a few drops of water)Until the spell ends, freezing rain and sleet fall in a 20-foot-tall cylinder with a 40-foot radius centered on a point you choose within range. The area is heavily obscured, and exposed flames in the area are doused.<br> The ground in the area is covered with slick ice, making it difficult terrain. When a creature enters the spell's area for the first time on a turn or starts its turn there, it must make a Dexterity saving throw. On a failed save, it falls prone.<br> If a creature is concentrating in the spell's area, the creature must make a successful Constitution saving throw against your spell save DC or lose concentration. ";"Cleric (Tempest)"
"3";"Vampiric Touch";"3rd level Necromancy";"1 action";"Self";"V, S";"Concentration, up to 1 minute";"The touch of your shadow-wreathed hand can siphon force from others to heal your wounds. Make a melee spell attack against a creature within your reach. On a hit, the target takes 3d6 necrotic damage, and you regain hit points equal to half the amount of necrotic damage dealt. Until the spell ends, you can make the attack again on each of your turns as an action.<br> <b>At Higher Levels</b>: When you cast this spell using a spell slot of 4th level or higher, the damage increases by 1d6 for each slot level above 3rd. ";"Cleric (Death)(Grave)"
"3";"Wind Wall";"3rd level Evocation";"1 action";"120 feet";"V, S, M";"Concentration, up to 1 minute";"(a tiny fan and a feather of exotic origin)A wall of strong wind rises from the ground at a point you choose within range. You can make the wall up to 50 feet long, 15 feet high, and 1 foot thick. You can shape the wall in any way you choose so long as it makes one continuous path along the ground. The wall lasts for the duration.<br> When the wall appears, each creature within its area must make a Strength saving throw. A creature takes 3d8 bludgeoning damage on a failed save, or half as much damage on a successful one.<br> The strong wind keeps fog, smoke, and other gases at bay. Small or smaller flying creatures or objects can't pass through the wall. Loose, lightweight materials brought into the wall fly upward. Arrows, bolts, and other ordinary projectiles launched at targets behind the wall are deflected upward and automatically miss. (Boulders hurled by giants or siege engines, and similar projectiles, are unaffected.) Creatures in gaseous form can't pass through it. ";"Cleric (Nature)"
"3";"Mass Healing Word";"3rd level Evocation";"1 bonus action";"60 feet";"V";"Instantaneous";"As you call out words of restoration, up to six creatures of your choice that you can see within range regain hit points equal to 1d4 + your spellcasting ability modifier. This spell has no effect on undead or constructs.<br> <b>At Higher Levels</b>: When you cast this spell using a spell slot of 4th level or higher, the healing increases by 1d4 for each slot level above 3rd. ";"Cleric (Order)"
"3";"Slow";"3rd level Transmutation";"1 action";"120 feet";"V, S, M";"Concentration, up to 1 minute";"(a drop of molasses)You alter time around up to six creatures of your choice in a 40-foot cube within range. Each target must succeed on a Wisdom saving throw or be affected by this spell for the duration.<br> An affected target's speed is halved, it takes a -2 penalty to AC and Dexterity saving throws, and it can't use reactions. On its turn, it can use either an action or a bonus action, not both. Regardless of the creature's abilities or magic items, it can't make more than one melee or ranged attack during its turn.<br> If the creature attempts to cast a spell with a casting time of 1 action, roll a d20. On an 11 or higher, the spell doesn't take effect until the creature's next turn, and the creature must use its action on that turn to complete the spell. If it can't, the spell is wasted.<br> A creature affected by this spell makes another Wisdom saving throw at the end of its turn. On a successful save, the effect ends for it. ";"Cleric (Order)"
"3";"Beacon of Hope";"3rd level Abjuration";"1 action";"30 feet";"V, S";"Concentration, up to 1 minute";"This spell bestows hope and vitality. Choose any number of creatures within range. For the duration, each target has advantage on Wisdom saving throws and death saving throws, and regains the maximum number of hit points possible from any healing.";"Cleric (Peace)"
"3";"Sending";"3rd level Evocation";"1 action";"Unlimited";"V, S, M";"1 round";"(A short piece of fine copper wire)You send a short message of twenty-five words or less to a creature with you are familiar. The creature hears the message in its mind, recognizes you as the sender if it knows you, and can answer in a like manner immediately. The spell enables creatures with Intelligence scores of at least 1 to understand the meaning of your message.<br> You can send the message across any distance and even to other planes of existence, but if the target is on a different plane than you, there is a 5 percent chance that the message doesn't arrive. ";"Cleric (Peace)"
"3";"Aura of Vitality";"3rd level Evocation";"1 action";"Self (30-foot radius)";"V";"Concentration, up to 1 minute";"Healing energy radiates from you in an aura with a 30-foot radius. Until the spell ends, the aura moves with you, centered on you. You can use a bonus action to cause one creature in the aura (including you) to regain 2d6 hit points.";"Cleric (Twilight)"
"3";"Leomund's Tiny Hut (Ritual)";"3rd level Evocation";"1 minute";"Self (10-foot-radius hemisphere)";"V, S, M";"8 hours";"(A small crystal bead)A 10-foot-radius immobile dome of force springs into existence around and above you and remains stationary for the duration. The spell ends if you leave its area.<br> 9 creatures of Medium size or smaller can fit inside the dome with you. The spell fails if its area includes a larger creature or more than 9 creatures. Creatures and objects within the dome when you cast this spell can move through it freely. All other creatures and objects are barred from passing through it. Spells and other magical effects can't extend through the dome or be cast through it. The atmosphere inside the space is comfortable and dry, regardless of the weather outside.<br> Until the spell ends, you can command the interior to become dimly lit or dark. The dome is opaque from the outside, of any color you choose, but it is transparent from the inside. ";"Cleric (Twilight)"
"4";"Arcane Eye";"4th level Divination";"1 action";"30 feet";"V, S, M";"Concentration, up to 1 hour";"(a bit of bat fur)You create an invisible, magical eye within range that hovers in the air for the duration.<br> You mentally receive visual information from the eye, which has normal vision and darkvision out to 30 feet. The eye can look in every direction.<br> As an action, you can move the eye up to 30 feet in any direction. There is no limit to how far away from you the eye can move, but it can't enter another plane of existence. A solid barrier blocks the eye's movement, but the eye can pass through an opening as small as 1 inch in diameter. ";"Cleric (Knowledge)(Arcana)"
"4";"Blight";"4th level Necromancy";"1 action";"30 feet";"V, S";"Instantaneous";"Necromantic energy washes over a creature of your choice that you can see within range, draining moisture and vitality from it. The target must make a Constitution saving throw. The target takes 8d8 necrotic damage on a failed save, or half as much damage on a successful one. This spell has no effect on undead or constructs.<br> If you target a plant creature or a magical plant, it makes the saving throw with disadvantage, and the spell deals maximum damage to it.<br> If you target a nonmagical plant that isn't a creature, such as a tree or shrub, it doesn't make a saving throw, it simply withers and dies.<br> <b>At Higher Levels</b>: When you cast this spell using a spell slot of 5th level or higher, the damage increases by 1d8 for each slot level above 4th. ";"Cleric (Death)(Grave)"
"4";"Confusion";"4th level Enchantment ";"1 action";"90 feet";"V, S, M";"Concentration, up to 1 minute";"(three nut shells)This spell assaults and twists creatures' minds, spawning delusions and provoking uncontrolled actions. Each creature in a 10-foot-radius sphere centered on a point you choose within range must succeed on a Wisdom saving throw when you cast this spell or be affected by it.<br> An affected target can't take reactions and must roll a d10 at the start of each of its turns to determine its behavior for that turn.<br> 1: The creature uses all its movement to move in a random direction. To determine the direction, roll a d8 and assign a direction to each die face. The creature doesn't take an action this turn.<br> 2-6: The creature doesn't move or take actions this turn.<br> 7-8: The creature uses its action to make a melee attack against a randomly determined creature within its reach. If there is no creature within its reach, the creature does nothing this turn.<br> 9-10: The creature can act and move normally. At the end of its turns, an affected target can make a Wisdom saving throw. If it succeeds, this effect ends for that target.<br> <b>At Higher Levels</b>: When you cast this spell using a spell slot of 5th level or higher, the radius of the sphere increases by 5 feet for each slot above 4th. ";"Cleric (Knowledge)"
"4";"Dimension Door";"4th level Conjuration";"1 action";"500 feet";"V";"Instantaneous";"You teleport yourself from your current location to any other spot within range. You arrive at exactly the spot desired. It can be a place you can see, one you can visualize, or one you can describe by stating distance and direction, such as 200 feet straight downward or upward to the northwest at a 45-degree angle, 300 feet.<br> You can bring along objects as long as their weight doesn't exceed what you can carry. You can also bring one willing creature of your size or smaller who is carrying gear up to its carrying capacity. The creature must be within 5 feet of you when you cast this spell.<br> If you would arrive in a place already occupied by an object or a creature, you and any creature traveling with you each take 4d6 force damage, and the spell fails to teleport you. ";"Cleric (Trickery)"
"4";"Dominate Beast";"4th level Enchantment ";"1 action";"60 feet";"V, S";"Concentration, up to 1 minute";"You attempt to beguile a beast that you can see within range. It must succeed on a Wisdom saving throw or be charmed by you for the duration. If you or creatures that are friendly to you are fighting it, it has advantage on the saving throw.<br> While the beast is charmed, you have a telepathic link with it as long as the two of you are on the same plane of existence. You can use this telepathic link to issue commands to the creature while you are conscious (no action required), which it does its best to obey. You can specify a simple and general course of action, such as Attack that creature, Run over there, or Fetch that object. If the creature completes the order and doesn't receive further direction from you, it defends and preserves itself to the best of its ability.<br> You can use your action to take total and precise control of the target. Until the end of your next turn, the creature takes only the actions you choose, and doesn't do anything that you don't allow it to do. During this time, you can also cause the creature to use a reaction, but this requires you to use your own reaction as well.<br> Each time the target takes damage, it makes a new Wisdom saving throw against the spell. If the saving throw succeeds, the spell ends.<br> <b>At Higher Levels</b>: When you cast this spell with a 5th-level spell slot, the duration is concentration, up to 10 minutes. When you use a 6th-level spell slot, the duration is concentration, up to 1 hour. When you use a spell slot of 7th level or higher, the duration is concentration, up to 8 hours. ";"Cleric (Nature)"
"4";"Grasping Vine";"4th level Conjuration";"1 bonus action";"30 feet";"V, S";"Concentration, up to 1 minute";"You conjure a vine that sprouts from the ground in an unoccupied space of your choice that you can see within range. When you cast this spell, you can direct the vine to lash out at a creature within 30 feet of it that you can see. That creature must succeed on a Dexterity saving throw or be pulled 20 feet directly toward the vine.<br> Until the spell ends, you can direct the vine to lash out at the same creature or another one as a bonus action on each of your turns. ";"Cleric (Nature)"
"4";"Ice Storm";"4th level Evocation";"1 action";"300 feet";"V, S, M";"Instantaneous";"(a pinch of dust and a few drops of water)A hail of rock-hard ice pounds to the ground in a 20-foot-radius, 40-foot-high cylinder centered on a point within range. Each creature in the cylinder must make a Dexterity saving throw. A creature takes 2d8 bludgeoning damage and 4d6 cold damage on a failed save, or half as much damage on a successful one.<br> Hailstones turn the storm's area of effect into difficult terrain until the end of your next turn.<br> <b>At Higher Levels</b>: When you cast this spell using a spell slot of 5th level or higher, the bludgeoning damage increases by 1d8 for each slot level above 4th. ";"Cleric (Tempest)"
"4";"Leomund's Secret Chest";"4th level Conjuration";"1 action";"Touch";"V, S, M";"Instantaneous";"(an exquisite chest, 3 feet by 2 feet by 2 feet, constructed from rare materials worth at least 5,000 gp, and a Tiny replica made from the same materials worth at least 50 gp)You hide a chest, and all its contents, on the Ethereal Plane. You must touch the chest and the miniature replica that serves as a material component for the spell. The chest can contain up to 12 cubic feet of nonliving material (3 feet by 2 feet by 2 feet).<br> While the chest remains on the Ethereal Plane, you can use an action and touch the replica to recall the chest. It appears in an unoccupied space on the ground within 5 feet of you. You can send the chest back to the Ethereal Plane by using an action and touching both the chest and the replica.<br> After 60 days, there is a cumulative 5 percent chance per day that the spell's effect ends. This effect ends if you cast this spell again, if the smaller replica chest is destroyed, or if you choose to end the spell as an action. If the spell ends and the larger chest is on the Ethereal Plane, it is irretrievably lost. ";"Cleric (Arcana)"
"4";"Polymorph";"4th level Transmutation";"1 action";"60 feet";"V, S, M";"Concentration, up to 1 hour";"(a caterpillar cocoon)This spell transforms a creature with at least 1 hit point that you can see within range into a new form. An unwilling creature must make a Wisdom saving throw to avoid the effect. A shapechanger automatically succeeds on this saving throw.<br> The transformation lasts for the duration, or until the target drops to 0 hit points or dies. The new form can be any beast whose challenge rating is equal to or less than the target's (or the target's level, if it doesn't have a challenge rating). The target's game statistics, including mental ability scores, are replaced by the statistics of the chosen beast. It retains its alignment and personality.<br> The target assumes the hit points of its new form. When it reverts to its normal form, the creature returns to the number of hit points it had before it transformed. If it reverts as a result of dropping to 0 hit points, any excess damage carries over to its normal form. As long as the excess damage doesn't reduce the creature's normal form to 0 hit points, it isn't knocked unconscious.<br> The creature is limited in the actions it can perform by the nature of its new form, and it can't speak, cast spells, or take any other action that requires hands or speech.<br> The target's gear melds into the new form. The creature can't activate, use, wield, or otherwise benefit from any of its equipment. ";"Cleric (Trickery)"
"4";"Stoneskin";"4th level Abjuration";"1 action";"Touch";"V, S, M";"Concentration, up to 1 hour";"(diamond dust worth 100 gp, which the spell consumes)This spell turns the flesh of a willing creature you touch as hard as stone. Until the spell ends, the target has resistance to nonmagical bludgeoning, piercing, and slashing damage.";"Cleric (War)"
"4";"Compulsion";"4th level Enchantment ";"1 action";"30 feet";"V, S";"Concentration, up to 1 minute";"Creatures of your choice that you can see within range and that can hear you must make a Wisdom saving throw. A target automatically succeeds on this saving throw if it can't be charmed. On a failed save, a target is affected by this spell. Until the spell ends, you can use a bonus action on each of your turns to designate a direction that is horizontal to you. Each affected target must use as much of its movement as possible to move in that direction on its next turn. It can take its action before it moves. After moving in this way, it can make another Wisdom saving throw to try to end the effect.<br> A target isn't compelled to move into an obviously deadly hazard, such as a fire pit, but it will provoke opportunity attacks to move in the designated direction. ";"Cleric (Order)"
"4";"Locate Creature";"4th level Divination";"1 action";"Self";"V, S, M";"Concentration, up to 1 hour";"(A bit of fur from a bloodhound)Describe or name a creature that is familiar to you. You sense the direction to the creature's location, as long as that creature is within 1,000 feet of you. If the creature is moving, you know the direction of its movement.<br> The spell can locate a specific creature known to you, or the nearest creature of a specific kind (such as a human or a unicorn), so long as you have seen such a creature up close - within 30 feet - at least once. If the creature you described or named is in a different form, such as being under the effects of a <i>polymorph</i> spell, this spell doesn't locate the creature.<br> This spell can't locate a creature if running water at least 10 feet wide blocks a direct path between you and the creature. ";"Cleric (Order)"
"4";"Aura of Purity";"4th level Abjuration";"1 action";"Self (30-foot radius)";"V";"Concentration, up to 10 minutes";"Purifying energy radiates from you in an aura with a 30-foot radius. Until the spell ends, the aura moves with you, centered on you. Each non-hostile creature in the aura (including you) can't become diseased, has resistance to poison damage, and has advantage on saving throws against effects that cause any of the following conditions: blinded, charmed, deafened, frightened, paralyzed, poisoned, and stunned.";"Cleric (Peace)"
"4";"Otiluke's Resilient Sphere";"4th level Evocation";"1 action";"30 feet";"V, S, M";"Concentration, up to 1 minute";"(a hemispherical piece of clear crystal and a matching hemispherical piece of gum arabic)A sphere of shimmering force encloses a creature or object of Large size or smaller within range. An unwilling creature must make a Dexterity saving throw. On a failed save, the creature is enclosed for the duration.<br> Nothing, not physical objects, energy, or other spell effects, can pass through the barrier, in or out, though a creature in the sphere can breathe there. The sphere is immune to all damage, and a creature or object inside can't be damaged by attacks or effects originating from outside, nor can a creature inside the sphere damage anything outside it.<br> The sphere is weightless and just large enough to contain the creature or object inside. An enclosed creature can use its action to push against the sphere's walls and thus roll the sphere at up to half the creature's speed. Similarly, the globe can be picked up and moved by other creatures. A <i>disintegrate</i> spell targeting the globe destroys it without harming anything inside it. ";"Cleric (Peace)"
"4";"Aura of Life";"4th level Abjuration";"1 action";"Self (30-foot radius)";"V";"Concentration, up to 10 minutes";"Life-preserving energy radiates from you in an aura with a 30-foot radius. Until the spell ends, the aura moves with you, centered on you. Each non-hostile creature in the aura (including you) has resistance to necrotic damage, and its hit point maximum can't be reduced. In addition, a non-hostile, living creature regains 1 hit point when it starts its turn in the aura with 0 hit points.";"Cleric (Twilight)"
"4";"Greater Invisibility";"4th level Illusion";"1 action";"Touch";"V, S";"Concentration, up to 1 minute";"You or a creature you touch becomes invisible until the spell ends. Anything the target is wearing or carrying is invisible as long as it is on the target's person.";"Cleric (Twilight)"
"5";"Antilife Shell";"5th level Abjuration";"1 action";"Self (10-foot radius)";"V, S";"Concentration, up to 1 hour";"A shimmering barrier extends out from you in a 10-foot radius and moves with you, remaining centered on you and hedging out creatures other than undead and constructs.<br> The barrier lasts for the duration. The barrier prevents an affected creature from passing or reaching through. An affected creature can cast spells or make attacks with ranged or reach weapons through the barrier.<br> If you move so that an affect creature is forced to pass through the barrier, the spell ends. ";"Cleric (Death)(Grave)"
